{
  "schema": 1,
  "guide_version": "1.2.0",
  "minimum_rain_version": "1.2.0",
  "generated_at": "2026-09-13T12:00:00Z",
  "bundle_url": "https://github.com/dasara-varun/rain-os/releases/download/v1.2.0/rain-guide-1.2.0.tar.zst",
  "bundle_sha256": "e3b0c44298fc1c149afbf4c8996fb92427ae41e4649b934ca495991b7852b855",
  "signature_url": "https://github.com/dasara-varun/rain-os/releases/download/v1.2.0/rain-guide-1.2.0.sig",
  "pages": [
    {
      "id": "welcome.start",
      "path": "01-welcome.md",
      "audience": "all",
      "profiles": [
        "core",
        "flow",
        "forge",
        "shield",
        "pocket",
        "cosmic"
      ]
    },
    {
      "id": "system.updates",
      "path": "02-updates-and-safety.md",
      "audience": "all",
      "profiles": [
        "core",
        "flow",
        "forge",
        "shield",
        "pocket",
        "cosmic"
      ]
    },
    {
      "id": "btrfs.snapshots",
      "path": "03-snapshots-and-recovery.md",
      "audience": "btrfs-users",
      "profiles": [
        "core",
        "flow",
        "forge",
        "shield",
        "pocket",
        "cosmic"
      ],
      "requires": [
        "btrfs"
      ]
    },
    {
      "id": "windows.compat",
      "path": "04-running-windows-apps.md",
      "audience": "desktop-users",
      "profiles": [
        "core",
        "flow",
        "forge",
        "pocket",
        "cosmic"
      ]
    },
    {
      "id": "hardware.drivers",
      "path": "05-hardware-and-drivers.md",
      "audience": "all",
      "profiles": [
        "core",
        "flow",
        "forge",
        "shield",
        "pocket",
        "cosmic"
      ]
    },
    {
      "id": "apps.software",
      "path": "06-app-store-and-software.md",
      "audience": "all",
      "profiles": [
        "core",
        "flow",
        "forge",
        "shield",
        "pocket",
        "cosmic"
      ]
    },
    {
      "id": "devices.multiscreen",
      "path": "07-displays-and-devices.md",
      "audience": "all",
      "profiles": [
        "core",
        "flow",
        "forge",
        "shield",
        "pocket",
        "cosmic"
      ]
    }
  ]
}